{
  "schema_version": "ai-film-studio/film-advisor-packet/v1",
  "packet_id": "film_packet_fixture_accepted",
  "activation": {"mode": "explicit", "invocation": "film-advisor"},
  "route": "shots",
  "project_root": "/project/fixture-film",
  "production_contract": {"status": "approved", "film_brief_id": "brief_fixture", "film_brief_sha256": "0000000000000000000000000000000000000000000000000000000000000000"},
  "requested_actions": [{"type": "plan", "target": "shot_fixture_threshold_001", "approval": {"status": "not_granted", "id": "", "action_type": "plan", "target": "shot_fixture_threshold_001", "evidence": {}}}]
}
